{
  "id": "work-001",
  "tenant_id": "tenant-alpha",
  "project_id": "proj-001",
  "title": "Migrate auth middleware",
  "type": "task",
  "status": "in_progress",
  "assigned_to": "engineer@ppm.example",
  "due_date": "2024-05-30",
  "classification": "confidential",
  "created_at": "2024-04-12T10:00:00Z",
  "updated_at": "2024-04-20T10:30:00Z"
}
